<?xml version="1.0" encoding="utf-8"?>
<!DOCTYPE quiz SYSTEM "quiz.dtd">
<quiz versao="1.0"><!-- a versão é demonstrativa -->
    <disciplina></disciplina>

    <professor>
        <nome></nome>
        <matricula></matricula>
    </professor>

    <turma></turma>

    <data></data>

    <questoes>
        <questao>
            <enunciado></enunciado>

            <pontuaçao></pontuaçao>

            <alternativas>
                <alternativa correta="sim"></alternativa>
            </alternativas>
        </questao>
    </questoes>
</quiz>